Book Id,Title,Author,ISBN,Publisher,Number of Pages,Original Publication Year,Date Read,Date Added,Read Count
386,28862,The Prince,Niccolò Machiavelli,0937832383,Dante University of America Press,140,1532,,2020/04/22,1
387,18757573,Financial Literacy: Finding Your Way in the Financial Markets,Connel Fullenkamp,,The Great Courses,12,2003,,2020/05/02,1
388,42069287,Understanding Investments,Connel Fullenkamp,,Great Courses,,,,2020/05/02,1
389,99894,The Boys from Brazil,Ira Levin,0394402677,Random House ,312,1976,,2020/04/30,1
390,4900,Heart of Darkness,Joseph Conrad,1892295490,Green Integer,188,1899,,2020/04/26,1
391,5206937,A Modest Proposal,Jonathan Swift,1605977276,Book Jungle,48,1729,,2020/04/26,1
392,1173576,What Every Body is Saying: An Ex-FBI Agent's Guide to Speed-Reading People,Joe Navarro,0061438294,Collins,250,2008,,2020/04/26,1
393,16280863,Intellectuals and Race,Thomas Sowell,0465058728,Basic Books,192,2013,,2020/04/24,1
394,43369,God Is Not Great: How Religion Poisons Everything,Christopher Hitchens,0446579807,Twelve,307,2007,,2020/04/23,1
395,14743,The God Delusion,Richard Dawkins,0618680004,Houghton Mifflin Co. (Boston/NY),374,2006,,2020/04/22,1
396,1473067,Linguistics: A Very Short Introduction,P.H. Matthews,0192801481,Oxford University Press, USA,152,2003,,2020/04/16,1
397,13689060,Languages: A Very Short Introduction,Stephen R. Anderson,0199590591,Oxford University Press, USA,152,,,2020/04/16,1
398,8921,The Hound of the Baskervilles (Sherlock Holmes, #5),Arthur Conan Doyle,,Signet,256,1901,,2020/04/15,1
399,1,Harry Potter and the Half-Blood Prince (Harry Potter, #6),J.K. Rowling,,Scholastic Inc.,652,2005,,2016/08/13,1
400,157076,The Most Dangerous Game,Richard Connell,1599869691,Filiquarian Publishing, LLC.,48,1924,,2020/04/13,1
401,368593,The 4-Hour Workweek,Timothy Ferriss,0307353133,Crown Business,308,2007,,2016/08/13,1
402,191139,Oh, the Places You'll Go!,Dr. Seuss,0679805273,Random House Books for Young Readers,44,1990,,2020/04/13,1
403,231804,The Outsiders,S.E. Hinton,,Puffin Books (US/CAN),192,1967,,2020/04/13,1
404,233093,The Cat in the Hat (The Cat in the Hat, #1),Dr. Seuss,039480001X,Random House Books for Young Readers,61,1957,,2020/04/13,1
405,23772,Green Eggs and Ham,Dr. Seuss,0394800168,Random House Books for Young Readers,64,1960,,2020/04/13,1
406,105999,Dear Mr. Henshaw (Leigh Botts, #1),Beverly Cleary,0380709589,HarperTrophy,134,1983,,2020/04/13,1
407,5354,The Brethren,John Grisham,0385339674,Delta,384,2000,,2020/04/05,1
408,36576608,Flowers for Algernon,Daniel Keyes,,,216,1959,,2020/04/05,1
409,17690,The Trial,Franz Kafka,,Vintage,255,1925,,2020/04/05,1
410,1860303,The Delikon,Helen Mary Hoover,0380409801,Avon Books,143,1977,,2020/04/05,1
411,77203,The Kite Runner,Khaled Hosseini,,Riverhead Books,371,2003,,2020/04/05,1
412,24178,Charlotte's Web,E.B. White,0064410935,HarperCollinsPublishers,184,1952,,2020/04/05,1
413,4671,The Great Gatsby,F. Scott Fitzgerald,,Scribner,200,1925,,2020/04/05,1
414,391729,The Tell-Tale Heart and Other Writings,Edgar Allan Poe,0553212281,Bantam Classics,448,1843,,2020/04/05,1
415,890,Of Mice and Men,John Steinbeck,0142000671,Penguin Books,112,1937,,2020/04/05,1
416,170448,Animal Farm,George Orwell,0451526341,Signet Classics,141,1945,,2020/04/05,1
417,5129,Brave New World,Aldous Huxley,0060929871,HarperPerennial / Perennial Classics,268,1932,,2020/04/05,1
418,13079982,Fahrenheit 451,Ray Bradbury,,Simon & Schuster,194,1953,,2020/04/05,1
419,40961427,1984,George Orwell,,Houghton Mifflin Harcourt,298,1949,,2020/04/05,1
420,5107,The Catcher in the Rye,J.D. Salinger,0316769177,Back Bay Books,277,1951,,2020/04/05,1
421,24724602,Flash Boys: A Wall Street Revolt,Michael   Lewis,0393351599,W. W. Norton  Company,304,2014,,2019/10/25,1
422,49162873,The Universal Computer: The Road from Leibniz to Turing, Third Edition,Martin Davis,1351384805,CRC Press,222,,,2020/03/30,1
423,29068,Teach Yourself to Play Mandolin,Dan  Fox,0739002864,Alfred Publishing Company,72,1996,,2017/11/05,1
424,9058034,Uncle Shelby's Scout Handbook,Shel Silverstein,,,29,2009,,2017/10/31,1
425,7742706,Draw A Skinny Elephant,Shel Silverstein,0060280530,HarperCollins Publishers,,,,2017/10/31,1
426,1530799,Don't Bump the Glump! and Other Fantasies,Shel Silverstein,0061493384,HarperCollins,64,1964,,2017/10/31,2
427,41888,A Giraffe and a Half,Shel Silverstein,0590471643,,48,1964,,2017/10/31,1
428,30122,The Missing Piece (The Missing Piece, #1),Shel Silverstein,0060256710,HarperCollins,112,1976,,2017/10/30,1
429,41890,Who Wants a Cheap Rhinoceros?,Shel Silverstein,0689851138,Simon  Schuster Books for Young Readers,64,1964,,2017/10/31,1
430,370493,The Giving Tree,Shel Silverstein,0060256656,HarperCollins Publishers,64,1964,,2017/10/30,1
431,29019,The Twelve Terrors of Christmas,John Updike,0764937103,Pomegranate Communications,32,1994,,2017/10/30,1
432,295,Treasure Island,Robert Louis Stevenson,0753453800,Kingfisher,311,1883,,2017/10/30,1
433,17184,The Invisible Man,H.G. Wells,0451528522,Signet Classics,192,1897,,2017/10/30,1
434,7604,Lolita,Vladimir Nabokov,,Penguin,331,1955,,2017/10/29,1
435,293951,Heroes,Robert Cormier,0440227690,Laurel Leaf,144,1998,,2017/10/27,1
436,869906,We All Fall Down,Robert Cormier,0440215560,Laurel Leaf,208,1991,,2017/10/27,1
437,588723,Beyond the Chocolate War (Chocolate War, #2),Robert Cormier,044090580X,Laurel-Leaf Books,288,1985,,2017/10/27,1
438,869907,After the First Death,Robert Cormier,0440208351,Laurel Leaf,240,1979,,2017/10/27,1
439,48974,I Am the Cheese,Robert Cormier,0141300515,Puffin Books,233,1977,,2017/10/27,1
440,17162,The Chocolate War (Chocolate War, #1),Robert Cormier,0375829873,Ember,267,1974,,2017/10/27,1
441,77013,As I Lay Dying,William Faulkner,,Vintage,288,1930,,2017/10/27,1
442,1460629,Knight's Gambit,William Faulkner,0451008251,Signet Book,,1949,,2017/10/27,1
443,6599421,For Whom the Bell Tolls,Ernest Hemingway,,Scribner,480,1940,,2017/10/27,1
444,46168,The Sun Also Rises,Ernest Hemingway,0684800713,Scribner,251,1926,,2017/10/27,1
445,10975,The Sound and the Fury,William Faulkner,,Vintage International,366,1929,,2017/10/27,1
446,6193662,Lord of the Flies,William Golding,0571245897,Faber & Faber,224,1954,,2017/10/27,1
447,10567,Cell,Stephen King,1416524517,Pocket Star Books,449,2006,,2017/10/27,1
448,11598,Cujo,Stephen King,,Signet Books,304,1981,,2017/10/27,1
449,10592,Carrie,Stephen King,1416524304,Pocket Books,253,1974,,2017/10/27,1
450,18003,The Gunslinger (The Dark Tower, #1),Stephen King,,Penguin Group New American Library Signet,300,1982,,2017/10/27,1
451,228202,The Stand,Stephen King,0451169530,Signet Books/Penguin Books USA Inc.,1141,1978,,2017/10/27,1
452,18342,It,Stephen King,0451169514,Signet,1090,1986,,2017/10/27,1
453,30756142,Romeo and Juliet,William Shakespeare,0003252450,HarperCollins Publishers,268,1597,,2017/10/27,1
454,919566,A Farewell To Arms,Ernest Hemingway,0020519001,Collier Books,332,1929,,2016/08/13,1
455,7082,Do Androids Dream of Electric Sheep?,Philip K. Dick,0345404475,Del Rey / Ballantine Books,244,1968,,2016/08/13,1
