Book Id,Title,Author,ISBN,Publisher,Number of Pages,Original Publication Year,Date Read,Date Added,Read Count
189,28633822,The Game Console: A Photographic History from Atari to Xbox,Evan Amos,1593277431,No Starch Press,264,2018,2020/04/13,2020/04/13,1
190,26263022,What Kind of Creatures Are We?,Noam Chomsky,0231175965,Columbia University Press,200,2015,2020/04/13,2020/04/13,1
191,28512671,Everybody Lies: Big Data, New Data, and What the Internet Can Tell Us About Who We Really Are,Seth Stephens-Davidowitz,0062390856,Dey Street Books,338,2017,2019/06/13,2019/06/12,1
192,6444424,The 4-Hour Workweek: Escape 9-5, Live Anywhere, and Join the New Rich,Timothy Ferriss,0307465357,Harmony,396,2007,2019/06/12,2017/11/13,1
193,1559,Oedipus the King,Sophocles,1416500332,Simon & Schuster,144,-429,2017/11/13,2017/11/12,1
194,3636,The Giver (The Giver, #1),Lois Lowry,0385732554,Ember,208,1993,2017/11/12,2017/10/29,1
195,2,Harry Potter and the Order of the Phoenix (Harry Potter, #5),J.K. Rowling,,Scholastic Inc.,870,2003,2017/10/27,2016/08/13,1
196,29405093,The Girl with the Lower Back Tattoo,Amy Schumer,1501139886,Gallery Books,323,2016,2016/01/01,2016/09/17,1
197,17407748,The Longest Ride,Nicholas Sparks,1455520659,Grand Central Publishing,398,2012,2016/01/01,2016/08/13,1
198,6525289,The Associate ,John Grisham,0440243823,Dell,434,2009,2016/01/01,2016/08/13,1
199,6280759,The Great Divorce,C.S. Lewis,0061774197,HarperOne,160,1945,2016/01/01,2016/08/13,1
200,168668,Catch-22,Joseph Heller,0684833395,Simon & Schuster ,453,1961,2010/01/01,2016/08/13,1
201,170512,Losing Ground: American Social Policy, 1950-1980,Charles Murray,0465042333,Basic Books,346,1983,,2020/04/13,1
202,113135,The Winner-Take-All Society: Why the Few at the Top Get So Much More Than the Rest of Us,Robert H. Frank,0140259953,Penguin Books,288,1995,,2021/03/17,1
203,183819,Sociobiology: The New Synthesis,Edward O. Wilson,0674002350,Belknap Press,720,1975,,2020/08/04,1
204,40097751,Operating System Concepts,Abraham Silberschatz,,Wiley,,1985,,2020/11/12,1
205,13748086,The Chosen Few: How Education Shaped Jewish History, 70-1492,Maristella Botticini,0691144877,Princeton University Press,344,2012,,2021/03/28,1
206,150437,A Farewell to Alms: A Brief Economic History of the World,Gregory Clark,0691121354,Princeton University Press,420,2007,,2020/09/01,1
207,22476,The Origins of the Urban Crisis: Race and Inequality in Postwar Detroit,Thomas J. Sugrue,0691121869,Princeton University Press,416,1996,,2021/11/24,1
208,53638991,The Cold Equations,Tom Godwin,,,33,1954,,2021/10/04,1
209,3836,Don Quixote,Miguel de Cervantes Saavedra,0142437239,Penguin Books,1023,1615,,2020/04/26,1
210,149800,Visual Complex Analysis,Tristan Needham,0198534469,Clarendon Press,616,1997,,2020/11/07,1
211,486686,Electroboy: A Memoir of Mania,Andy Behrman,0812967089,Random House Trade Paperbacks,304,2002,,2016/08/13,1
212,43261194,On the Plain of Snakes: A Mexican Journey,Paul Theroux,0544866479,Mariner Books,448,2019,,2020/04/23,1
213,84369,The Last Battle (Chronicles of Narnia, #7),C.S. Lewis,0007202326,HarperCollins Publishers,288,1956,,2017/10/29,1
214,65605,The Magician's Nephew (Chronicles of Narnia, #6),C.S. Lewis,0060764902,HarperCollins Publishers,221,1955,,2017/10/29,1
215,84119,The Horse and His Boy (Chronicles of Narnia, #5),C.S. Lewis,0439861365,Scholastic Inc,224,1954,,2017/10/29,1
216,65641,The Silver Chair (Chronicles of Narnia, #4),C.S. Lewis,,HarperCollins,243,1953,,2017/10/29,1
217,140225,The Voyage of the Dawn Treader (Chronicles of Narnia, #3),C.S. Lewis,006112527X,HarperCollins,248,1952,,2017/10/29,1
218,121749,Prince Caspian (Chronicles of Narnia, #2),C.S. Lewis,000720230X,HarperCollins Publishers,240,1951,,2017/10/29,1
219,100915,The Lion, the Witch and the Wardrobe (Chronicles of Narnia, #1),C.S. Lewis,,HarperCollins Publishers,206,1950,,2021/08/09,1
220,108087,Algebraic Topology,Allen Hatcher,0521795400,Cambridge University Press,558,2001,,2020/10/31,1
221,517233,Introduction to Probability,Dimitri P. Bertsekas,188652940X,Athena Scientific,430,2002,,2021/04/12,1
222,17816657,Introduction to Modern Cryptography,Jonathan Ned Katz,1466570261,CRC Press,603,2007,,2021/04/12,1
223,22237225,Flashpoints: The Emerging Crisis in Europe,George Friedman,038553633X,Doubleday Books,258,2015,,2020/05/03,1
224,265091,Race And Culture: A World View,Thomas Sowell,0465067972,Basic Books,352,1995,,2020/04/24,1
225,795150,The Coming of Post-Industrial Society: A Venture in Social Forecasting,Daniel Bell,0465097138,Basic Books, Perseus Books Group,507,1973,,2020/09/11,1
226,12984064,The Chosen People: A Study of Jewish Intelligence and Achievement,Richard Lynn,1593680368,Washington Summit Publishers,405,2011,,2020/09/01,1
227,501337,A Frozen Hell: The Russo-Finnish Winter War of 1939-1940,William R. Trotter,1565122496,Algonquin Books,285,1991,,2020/09/09,1
228,23113377,The Clash of Progress and Security,Allan G.B. Fisher,,,,1935,,2020/08/04,1
229,2890506,The Jews of Hungary: History, Culture, Psychology,Raphael Patai,0814325610,Wayne State University Press,736,1996,,2021/03/28,1
230,1105766,The Jewish Mind,Raphael Patai,081432651X,Wayne State University Press,,1977,,2021/03/28,1
231,24485082,The Suez War,Paul  Johnson,,Bloomsbury Reader,110,1957,,2021/03/28,1
232,263859,The Civilization of Ancient Egypt,Paul  Johnson,0060194340,Harper,240,1978,,2021/03/27,1
233,1467124,Castles from the Air: An Aerial Portrait of Britain's Finest Castles,Paul  Johnson,0747587469,Bloomsbury Publishing PLC,,2006,,2021/03/28,1
234,89413,A History of the English People,Paul  Johnson,0061320757,Harper Torchbooks,480,1972,,2021/03/27,1
235,564278,Heroes: From Alexander the Great & Julius Caesar to Churchill & de Gaulle,Paul  Johnson,0061143162,Harper,320,2007,,2021/03/27,1
236,872480,Creators: From Chaucer and Durer to Picasso and Disney,Paul  Johnson,0060191430,Harper,320,2006,,2021/03/27,1
237,7736134,Jesus: A Biography, from a Believer,Paul  Johnson,0670021598,Viking Adult,256,2010,,2021/03/27,1
238,55300,Napoleon: A Life,Paul  Johnson,0143037455,Penguin Books,208,2002,,2021/03/27,1
239,89448,A History of Christianity,Paul  Johnson,0684815036,Touchstone,576,1976,,2021/03/27,1
240,358936,A History of the Jews,Paul  Johnson,0060915331,Harper & Row,644,1987,,2021/03/27,1
241,7550775,The Golden Age of Jewish Achievement: The Compendium of a Culture, a People, and Their Stunning Performance,Steven L. Pease,0982516800,Deucalion,626,2009,,2021/03/27,1
242,39510142,The Suez Crisis: The History of the Suez Canal’s Nationalization by Egypt and the War that Followed,Charles River Editors,,Charles River Editors,53,,,2021/03/27,1
243,16182409,Cybersecurity and Cyberwar: What Everyone Needs to Know(r),P.W. Singer,0199918112,Oxford University Press, USA,320,2013,,2021/03/26,1
244,38748986,Red Flags: Why Xi's China Is in Jeopardy,George Magnus,0300233191,Yale University Press,248,2018,,2021/03/26,1
245,38748983,The Great Delusion: Liberal Dreams and International Realities,John J. Mearsheimer,,Yale University Press,328,2018,,2021/03/26,1
246,35989044,Russia's Military Revival,Bettina Renz,150951614X,Polity Press,240,2018,,2021/03/26,1
247,86349,Chechnya: Calamity in the Caucasus,Carlotta Gall,0814731325,New York University Press,416,1997,,2021/03/26,1
248,7648592,The Caucasus: An Introduction,Thomas de Waal,0195399773,Oxford University Press, USA,272,2010,,2021/03/26,1
249,9236387,Afghanistan At The Crossroads: Insights On The Conflict,Stratfor,1452865213,Createspace Independent Publishing Platform,220,2010,,2021/03/25,1
250,8027483,Mexico In Crisis: Lost Borders And The Struggle For Regional Status,Stratfor,1449905714,Createspace,286,,,2021/03/25,1
251,9966512,China: Power and Perils,Stratfor,1453866078,Createspace Independent Publishing Platform,284,2010,,2021/03/25,1
252,8008436,How to Look for Trouble: A Stratfor Guide to Protective Intelligence,Stratfor,1451528205,Createspace,156,2010,,2021/03/25,1
253,36669880,North Korea's Nuclear Gambit,Stratfor,1461068681,CreateSpace Independent Publishing Platform,130,,,2021/03/25,1
254,49587256,The Storm Before the Calm: America's Discord, the Coming Crisis of the 2020s, and the Triumph Beyond,George Friedman,,Doubleday Books,256,,,2021/03/25,1
255,15931672,Economic Networks,David Knoke,074564998X,Polity Press,180,2012,,2021/03/18,1
256,13354253,Borderlands: A Geopolitical Journey in Eurasia,George Friedman,1456519042,Createspace Independent Publishing Platform,112,2011,,2021/03/25,1
257,2587844,Commitment,Pankaj Ghemawat,0029115752,Free Press,178,1991,,2021/03/18,1
258,2587845,Games Businesses Play: Cases and Models,Pankaj Ghemawat,0262071827,MIT Press,274,1997,,2021/03/18,1
259,1679373,Strategy And The Business Landscape,Pankaj Ghemawat,0131430351,Prentice Hall,159,1999,,2021/03/18,1
260,1679375,Redefining Global Strategy: Crossing Borders in a World Where Differences Still Matter,Pankaj Ghemawat,1591398665,Harvard Business Review Press,257,2007,,2021/03/18,1
261,11178053,World 3.0: Global Prosperity and How to Achieve It,Pankaj Ghemawat,142213864X,Harvard Business Review Press,400,2011,,2021/03/18,1
262,37803326,The New Global Road Map: Enduring Strategies for Turbulent Times,Pankaj Ghemawat,,,,,,2021/03/18,1
263,6307751,Stumbling on Wins: Two Economists Expose the Pitfalls on the Road to Victory in Professional Sports,David J. Berri,013235778X,FT Press,237,2009,,2021/03/18,1
264,1198911,Searching for a Corporate Savior: The Irrational Quest for Charismatic CEOs,Rakesh Khurana,0691120390,Princeton University Press,295,2002,,2021/03/17,1
265,7966182,The Shadow Market: How Sovereign Wealth Funds and Rogue Nations Threaten America's Financial Future,Eric J. Weiner,143910915X,Scribner,320,2010,,2021/03/17,1
266,49151008,Made in China: A Prisoner, an SOS Letter, and the Hidden Cost of America's Cheap Goods,Amelia Pang,1616209178,Algonquin Books,288,2021,,2021/03/17,1
267,298903,Turbo-Capitalism: Winners and Losers in the Global Economy,Edward N. Luttwak,006093137X,Harper Perennial,304,1998,,2021/03/17,1
268,2088698,Game, Set and Math: Enigmas and Conundrums,Ian Stewart,0140132376,Penguin Books,208,1989,,2021/03/17,1
269,30652247,How to Kill a City: Gentrification, Inequality, and the Fight for the Neighborhood,Peter Moskowitz,1568585233,Bold Type Books,272,2017,,2021/03/17,1
270,2564796,The Hunger Winter: Occupied Holland 1944-1945,Henri A. van der Zee,0803296185,University of Nebraska Press,347,1979,,2021/03/15,1
271,563101,The Tangled Field: Barbara McClintock's Search for the Patterns of Genetic Control,Nathaniel C. Comfort,0674011082,Harvard University Press,337,2001,,2021/03/15,1
272,291072,The Informational City: Economic Restructuring and Urban Development,Manuel Castells,0631179372,Wiley-Blackwell,416,1989,,2021/03/15,1
273,32201648,Laid Low: Inside the Crisis That Overwhelmed Europe and the IMF,Paul Blustein,1928096336,CIGI Press,504,,,2021/03/03,1
274,6665610,Misadventures of the Most Favored Nations: Clashing Egos, Inflated Ambitions, and the Great Shambles of the World Trade System,Paul Blustein,1586487183,PublicAffairs,344,2009,,2021/03/03,1
275,642889,And the Money Kept Rolling In (and Out) Wall Street, the IMF, and the Bankrupting of Argentina,Paul Blustein,1586483811,PublicAffairs,304,2005,,2021/03/03,1
276,40490600,Bring Us Together: The Nixon Team's Retreat on Civil Rights,Leon Panetta,,Lippincott,380,,,2021/03/02,1
277,2234421,The Fiscal Revolution in America: Policy in Pursuit of Reality,Herbert Stein,0844739375,AEI Press,640,1969,,2021/03/02,1
278,920156,A History of Interest Rates (Wiley Finance),Sidney Homer,0471732834,Wiley,736,1977,,2021/03/02,1
279,21552419,Trillion Dollar Economists: How Economists and Their Ideas Have Transformed Business,Robert E. Litan,1118781805,Wiley,385,2014,,2021/03/01,1
280,11431129,A Bloody Business: America's War Zone Contractors and the Occupation of Iraq,Gerry Schumacher,1610600681,Zenith Press,304,2006,,2021/03/01,1
281,13838443,Cannibal Capitalism: How Big Business and the Feds Are Ruining America,Michael C. Hill,111817531X,Wiley,256,2011,,2021/03/01,1
282,9520342,The Devil's Derivatives: The Untold Story of the Slick Traders and Hapless Regulators Who Almost Blew Up Wall Street . . . and Are Ready to Do It Again,Nicholas Dunbar,1422177815,Harvard Business Review Press,320,2011,,2021/03/01,1
283,9015686,Crash of the Titans: Greed, Hubris, the Fall of Merrill Lynch, and the Near-Collapse of Bank of America,Greg Farrell,0307717860,Crown Business,471,2010,,2021/03/01,1
284,2812081,The Business of Japanese Foreign Aid: Five Cases from Asia,Marie Sodergerg,0415138787,Routledge,318,1996,,2021/03/01,1
285,6569694,In FED We Trust: Ben Bernanke's War on the Great Panic,David Wessel,0307459683,Crown Business,336,2009,,2021/03/01,1
286,10898755,Fixing the Game: Bubbles, Crashes, and What Capitalism Can Learn from the NFL,Roger L. Martin,1422171647,Harvard Business Review Press,272,2011,,2021/03/01,1
287,16248495,Subsidies to Chinese Industry: State Capitalism, Business Strategy, and Trade Policy,Usha C.V. Haley,0199773742,Oxford University Press, USA,272,2013,,2021/03/01,1
288,2969660,Princes of the Yen: Japan's Central Bankers and the Transformation of the Economy,Richard A. Werner,0765610485,M.E. Sharpe,362,2003,,2021/01/03,1
289,10290318,Philosophy of Mathematics: Oxford Bibliographies Online Research Guide,Otávio Bueno,0199808937,Oxford University Press, USA,0,2010,,2020/12/15,1
290,25845273,The Great Divorce,C.S. Lewis,,HarperCollins,146,1945,,2020/11/18,1
291,244904,The New Industrial State,John Kenneth Galbraith,0691131414,Princeton University Press,576,1967,,2020/10/18,1
292,6318095,The Last Eunuch Of China,Yinghua Jia,7508514076,New Phoenix Intl Llc,314,2008,,2021/03/29,1
293,1244377,Taboo: Why Black Athletes Dominate Sports And Why We're Afraid To Talk About It,Jon Entine,158648026X,PublicAffairs,400,1999,,2021/03/28,1
294,87181,The World's Banker: A Story of Failed States, Financial Crises, and the Wealth and Poverty of Nations,Sebastian Mallaby,0143036793,Penguin Books,496,2004,,2021/03/28,1
295,13747687,Born Together--Reared Apart: The Landmark Minnesota Twin Study,Nancy L. Segal,0674055462,Harvard University Press,410,2012,,2021/03/28,1
296,1178081,The New Americans: How the Melting Pot Can Work Again,Michael Barone,1596980265,Regnery Publishing,340,2001,,2021/03/28,1
297,15872503,Jews, Confucians, and Protestants: Cultural Capital and the End of Multiculturalism,Lawrence E. Harrison,1442219637,Rowman & Littlefield Publishers,230,2012,,2021/03/28,1
298,18114115,The Triple Package: How Three Unlikely Traits Explain the Rise and Fall of Cultural Groups in America,Amy Chua,1594205469,Penguin Press,336,2014,,2021/03/28,1
299,30267,The Central Liberal Truth: How Politics Can Change a Culture and Save It from Itself,Lawrence E. Harrison,0195300416,Oxford University Press, USA,288,2006,,2021/03/28,1
300,209184,Culture Matters: How Values Shape Human Progress,Lawrence E. Harrison,0465031765,Basic Books,384,2000,,2021/03/28,1
301,209102,Conquests and Cultures: An International History,Thomas Sowell,0465014003,Basic Books,516,1998,,2021/03/28,1
302,1139176,Migrations and Cultures: A World View,Thomas Sowell,0465045898,Basic Books,516,1996,,2021/03/28,1
303,21073,The Embarrassment of Riches: An Interpretation of Dutch Culture in the Golden Age,Simon Schama,0679781242,Vintage,720,1987,,2021/03/28,1
304,6476509,The Invention of the Jewish People,Shlomo Sand,1844674223,Verso,332,2008,,2021/03/28,1
305,16003595,The Story of the Jews: Finding the Words, 1000 BCE – 1492 CE,Simon Schama,1847921329,Bodley Head,496,2013,,2021/03/28,1
306,245474,The Jewish Century,Yuri Slezkine,0691127603,Princeton University Press,456,2004,,2021/03/28,1
307,8210,The Jewish Phenomenon: Seven Keys to the Enduring Wealth of a People,Steven Silbiger,1563525666,Longstreet Press,256,2000,,2021/03/28,1
308,179090,The Thirteenth Tribe: The Khazar Empire and its Heritage,Arthur Koestler,0394402847,Random House (NYC),256,1976,,2021/03/28,1
309,2889752,The Jewish Mystique,Ernest Van den Haag,0812812670,Stein & Day Pub,252,1969,,2021/03/28,1
310,1155302,Glut: Mastering Information through the Ages,Alex Wright,0309102383,Joseph Henry Press,286,2007,,2021/04/04,1
311,18699137,Cataloging the World: Paul Otlet and the Birth of the Information Age,Alex Wright,0199931410,Oxford University Press, USA,360,2014,,2021/04/04,1
312,33595363,Beethoven in China: How the Great Composer Became an Icon in the People's Republic: Penguin Specials,Jindong Cai,,e-penguin,100,,,2021/04/04,1
313,6043635,Les trente glorieuses : ou, La Révolution invisible de 1946 à 1975,Jean Fourastié,2253026379,Fayard,288,1979,,2021/04/03,1
314,896642,The Forgetting: Alzheimer's: Portrait of an Epidemic,David Shenk,0385498381,Anchor,304,,,2021/04/03,1
315,4250917,The Conditions Of Economic Progress,Colin Clark,0824053524,Dissertations-G,,,,2021/04/03,1
316,3694979,Beyond the Welfare State: Economic Planning and Its International Implications,Gunnar Myrdal,0313236976,Praeger,287,1961,,2021/03/30,1
317,781857,An American Dilemma: The Negro Problem and Modern Democracy Vol. 1,Gunnar Myrdal,1560008563,Routledge,812,1944,,2021/03/30,1
318,18079745,Me, Myself, and Why: Searching for the Science of Self,Jennifer Ouellette,0143121650,Penguin,336,2014,,2021/03/29,1
319,13211226,The Genealogical Science: The Search for Jewish Origins and the Politics of Epistemology,Nadia Abu El-Haj,0226201406,University of Chicago Press,328,2012,,2021/03/29,1
320,18079605,Smarter: The New Science of Building Brain Power,Dan Hurley,1594631271,Avery,275,2013,,2021/03/29,1
321,10521948,Epigenetics: The Ultimate Mystery of Inheritance,Richard C. Francis,0393070050,W. W. Norton & Company,256,2011,,2021/03/29,1
322,12263681,The Age of Insight: The Quest to Understand the Unconscious in Art, Mind, and Brain from Vienna 1900 to the Present,Eric R. Kandel,1400068711,Random House,656,2012,,2021/03/29,1
323,4580836,The Gamble: General David Petraeus and the American Military Adventure in Iraq, 2006-2008,Thomas E. Ricks,1594201978,The Penguin Press,394,2009,,2021/03/29,1
324,15802422,The Insurgents: David Petraeus and the Plot to Change the American Way of War,Fred   Kaplan,1451642636,Simon & Schuster, Inc.,418,2013,,2021/03/29,1
325,1225914,Telecosm: How Infinite Bandwidth Will Revolutionize Our World,George Gilder,0684809303,Simon & Schuster,351,1996,,2021/03/29,1
326,32073021,Life After Google: The Fall of Big Data and the Rise of the Blockchain Economy,George Gilder,1621575764,Regnery Gateway,256,2018,,2021/03/29,1
327,6593355,The Israel Test,George Gilder,0980076358,Richard Vigilante Books,296,2009,,2021/03/29,1
328,1258676,The Perfect Servant: Eunuchs and the Social Construction of Gender in Byzantium,Kathryn M. Ringrose,0226720152,University Of Chicago Press,312,2003,,2021/03/29,1
329,13400,Molecular Biology of the Cell,Bruce Alberts,0815332181,Garland Science,1616,1983,,2021/03/28,1
330,328802,Totto-chan: The Little Girl at the Window,Tetsuko Kuroyanagi,4770020678,Kodansha,232,1981,,2021/04/04,1
331,6098718,Wired for War: The Robotics Revolution and Conflict in the Twenty-First Century,P.W. Singer,1594201986,Penguin Press,499,2009,,2021/03/26,1
332,27202,The Gifts of the Jews: How a Tribe of Desert Nomads Changed the Way Everyone Thinks and Feels,Thomas Cahill,074595054X,Lion Hudson plc,304,1998,,2021/03/28,1
333,6885191,Start-up Nation: The Story of Israel's Economic Miracle,Dan Senor,044654146X,Twelve,304,2009,,2021/03/28,1
334,15998338,The Buy Side: A Wall Street Trader's Tale of Spectacular Excess,Turney Duff,077043715X,Crown Business,320,2013,,2021/03/01,1
335,22085568,The Culture Map: Breaking Through the Invisible Boundaries of Global Business,Erin Meyer,,PublicAffairs,290,2014,,2021/03/01,1
336,2865,Girl with a Pearl Earring,Tracy Chevalier,0452287022,Plume/Penguin,233,1999,,2021/03/01,1
337,13539185,Foundation: The History of England from Its Earliest Beginnings to the Tudors (The History of England, #1),Peter Ackroyd,125000361X,Thomas Dunne Books,496,2011,,2020/11/19,1
338,4591,Genome: the Autobiography of a Species in 23 Chapters,Matt Ridley,0060894083,Harper Perennial,344,1999,,2020/09/26,1
339,16130157,The Firm: The Story of McKinsey and Its Secret Influence on American Business,Duff McDonald,1439190992,Simon  Schuster,400,2013,,2020/10/09,1
340,55539565,Think Again: The Power of Knowing What You Don't Know,Adam M. Grant,1984878107,Viking Books,307,2021,,2021/03/01,1
341,46223297,Permanent Record,Edward Snowden,1250237238,Metropolitan Books,339,2019,,2020/09/12,1
342,126061,The Double Helix,James D. Watson,0451037707,Signet Books,143,1968,,2020/08/12,1
343,52290273,The Future Is Faster Than You Think: How Converging Technologies Are Transforming Business, Industries, and Our Lives,Peter H. Diamandis,1982109661,Simon  Schuster,384,2020,,2020/08/03,1
344,125286,The Beak of the Finch: A Story of Evolution in Our Time,Jonathan Weiner,067973337X,Vintage,332,1994,,2020/08/04,1
345,6372440,This Time Is Different: Eight Centuries of Financial Folly,Carmen M. Reinhart,0691142165,Princeton University Press,460,2009,,2020/04/24,1
346,12917124,Dark Pools: The Rise of Artificially Intelligent Trading Machines and the Looming Threat to Wall Street,Scott Patterson,0307887170,Crown Publishing Group,368,2012,,2020/05/09,1
347,540346,DNA: The Secret of Life,James D. Watson,0375710078,Knopf,464,2002,,2020/05/09,1
348,20588698,Not That Kind of Girl: A Young Woman Tells You What She's "Learned",Lena Dunham,081299499X,Random House,265,2014,,2020/05/03,1
349,281818,Where Wizards Stay Up Late: The Origins of the Internet,Katie Hafner,0684832674,Simon  Schuster,304,1996,,2020/05/07,1
350,10335308,Is Everyone Hanging Out Without Me? (And Other Concerns),Mindy Kaling,0307886263,Crown Archetype,222,2011,,2020/04/22,1
351,119561,The Order of Things: An Archaeology of the Human Sciences,Michel Foucault,0679753354,Vintage,416,1966,,2020/04/19,1
352,17288660,Amsterdam: A History of the World's Most Liberal City,Russell Shorto,0385534574,Doubleday,368,2013,,2020/04/23,1
353,26889576,The Big Short: Inside the Doomsday Machine,Michael   Lewis,039335315X,W. W. Norton  Company,320,2010,,2019/10/25,1
354,433439,Elements of Information Theory,Thomas M. Cover,0471241954,Wiley-Interscience,792,1991,,2021/04/12,1
355,7144,Crime and Punishment,Fyodor Dostoevsky,0143058142,Penguin,671,1866,,2016/08/13,1
356,8492907,Physics of the Future: How Science Will Shape Human Destiny and Our Daily Lives by the Year 2100,Michio Kaku,0385530803,Doubleday,416,2011,,2020/04/05,1
357,33426,Hyperspace: A Scientific Odyssey Through Parallel Universes, Time Warps, and the Tenth Dimension,Michio Kaku,0192861891,Oxford Univ Pr (T),359,1994,,2020/04/05,1
358,28593460,The Cognitive Neuroscience of Metacognition,Stephen M. Fleming,,Springer,407,2014,,2020/10/24,1
359,11256979,The Magic of Reality: How We Know What's Really True,Richard Dawkins,1439192812,Free Press,271,2011,,2020/10/31,1
360,40240329,Law 101: Everything You Need to Know About American Law,Jay M. Feinman,,Oxford University Press,376,2000,,2020/04/26,1
361,31487,Unweaving the Rainbow: Science, Delusion and the Appetite for Wonder,Richard Dawkins,0618056734,Mariner Books,352,1998,,2020/10/31,1
362,117047,The Blind Watchmaker: Why the Evidence of Evolution Reveals a Universe Without Design,Richard Dawkins,0141026162,Penguin,466,1986,,2020/04/26,1
363,6117055,The Greatest Show on Earth: The Evidence for Evolution,Richard Dawkins,059306173X,Bantam Press,470,2009,,2020/04/26,1
364,355697,All Quiet on the Western Front,Erich Maria Remarque,0449213943,Ballantine Books,296,1929,,2016/08/13,1
365,20550401,December Sky,Evelyn Cortez-Davis,0976838206,In Xochitl In Cuicatl (2003),181,2003,,2020/10/26,1
366,302236,Sex,Madonna,8440631170,Ediciones B,134,1992,,2020/10/19,2
367,699768,Getting Things Done: The Art of Stress-Free Productivity,David    Allen,0670899240,Viking,267,2001,,2016/08/13,1
368,6119978,You May Ask Yourself: An Introduction to Thinking Like a Sociologist,Dalton Conley,0393927601,W. W. Norton & Company,801,,,2017/10/27,1
369,10770366,Car: The Definitive Visual History of the Automobile,Kathryn Hennessy,0756671671,DK Publishing,360,2011,,2020/10/09,1
370,22584,Flow My Tears, the Policeman Said,Philip K. Dick,1857983416,Gollancz  ,204,1974,,2020/10/09,1
371,22590,Ubik,Philip K. Dick,8498000831,La factoría de ideas,288,1969,,2020/10/09,1
372,216363,The Man in the High Castle,Philip K. Dick,0679740678,Vintage,259,1962,,2020/10/09,1
373,36402034,Do Androids Dream of Electric Sheep?,Philip K. Dick,,Ballantine Books,258,1968,,2020/10/09,1
374,3,Harry Potter and the Sorcerer's Stone (Harry Potter, #1),J.K. Rowling,,Scholastic Inc,309,1997,,2016/08/13,1
375,5,Harry Potter and the Prisoner of Azkaban (Harry Potter, #3),J.K. Rowling,043965548X,Scholastic Inc.,435,1999,,2016/08/13,1
376,15881,Harry Potter and the Chamber of Secrets (Harry Potter, #2),J.K. Rowling,,Arthur A. Levine Books,341,1998,,2016/08/13,1
377,6,Harry Potter and the Goblet of Fire (Harry Potter, #4),J.K. Rowling,,Scholastic,734,2000,,2016/08/13,1
378,136251,Harry Potter and the Deathly Hallows (Harry Potter, #7),J.K. Rowling,,Arthur A. Levine Books,759,2007,,2016/08/13,1
379,2657,To Kill a Mockingbird,Harper Lee,,Harper Perennial Modern Classics ,336,1960,,2020/04/05,1
380,3869,A Brief History of Time,Stephen Hawking,0553380168,Bantam Books,212,1988,,2020/04/06,1
381,10898140,The Barbarian Nurseries,Héctor Tobar,0374108994,Farrar, Straus and Giroux,422,2011,,2020/09/05,1
382,452382,The Rain God,Arturo Islas,0380763931,Harper Perennial,192,1984,,2020/09/05,1
383,9754566,Chicana Power!: Contested Histories of Feminism in the Chicano Movement,Maylei Blackwell,0292725884,University of Texas Press,300,2011,,2020/09/05,1
384,44652433,Language Families of the World,John McWhorter,,The Great Courses,16,2019,,2020/07/28,1
385,4948,The Very Hungry Caterpillar,Eric Carle,0241003008,Puffin Books,26,1969,,2020/05/08,1
